question,answer,retrieved_sources
Почему кошки хорошо видят в сумерках?,"В сетчатке кошки много палочек — клеток, которые хорошо работают в сумерках. При этом кошки различают цвета хуже человека и видят мир менее насыщенным по оттенкам.","cat_003, cat_009, cat_003"
Зачем кошке нужны вибриссы?,"Вибриссы помогают кошке оценивать расстояние до объектов, чувствовать движение воздуха и лучше ориентироваться в темноте. Гибкость тела помогает кошке во время охоты, лазания и прыжков.","cat_005, cat_005, cat_002"
Почему мурлыканье не всегда означает удовольствие?,Поэтому мурлыканье не всегда означает только удовольствие. Поэтому мурлыканье не всегда означает только удовольствие.,"cat_006, cat_006, cat_009"
Какие условия среды важны для благополучия кошки?,"Изучение территориальности важно для понимания стресса, поведения и организации среды для домашних кошек. Благополучие домашней кошки зависит не только от питания, но и от качества среды.","cat_012, cat_008, cat_013"
Почему кошки часто приземляются на лапы?,"Особенно заметно это у котят, но и взрослые кошки часто сохраняют выраженную игровую активность. Во время падения кошка быстро меняет положение головы, позвоночника и конечностей, чтобы сориентировать тело и увеличить вероятность приземления на лапы.","cat_015, cat_014, cat_005"
